{
  "type": "turn",
  "turn": 13,
  "set_version": 58,
  "based_on_seq": 3,
  "raw_choice": "restart_play_mode",
  "effective_choice": "restart_play_mode",
  "executed_action": null,
  "outcome": "restarted",
  "operation": {
    "kind": "restart_play_mode",
    "status": "ready",
    "ticket_id": "ticket-1",
    "from_generation": "11111111-1111-4111-8111-111111111111",
    "to_generation": "22222222-2222-4222-8222-222222222222",
    "reason": null
  }
}
